{
  "$schema": "https://json-schema.org/draft/2020-12/schema",
  "contractId": "https://data.oireachtas.ie/specs/query-schema-contract",
  "contractSchema": "poc/specs/query-schema-contract.schema.json",
  "schemaVersion": 1,
  "contractVersion": "2.7.0",
  "description": "Queryable, currently emitted Oireachtas RDF patterns and local NLQ execution boundary.",
  "namespaces": {
    "agents": "https://data.oireachtas.ie/ontology#",
    "members": "https://data.oireachtas.ie/ontology/members#",
    "rdf": "http://www.w3.org/1999/02/22-rdf-syntax-ns#",
    "rdfs": "http://www.w3.org/2000/01/rdf-schema#",
    "owl": "http://www.w3.org/2002/07/owl#",
    "skos": "http://www.w3.org/2004/02/skos/core#",
    "foaf": "http://xmlns.com/foaf/0.1/",
    "dct": "http://purl.org/dc/terms/",
    "dcat": "http://www.w3.org/ns/dcat#",
    "eli": "http://data.europa.eu/eli/ontology#",
    "eli-dl": "http://data.europa.eu/eli/eli-draft-legislation-ontology#",
    "org": "http://www.w3.org/ns/org#",
    "xsd": "http://www.w3.org/2001/XMLSchema#"
  },
  "queryableClasses": [
    "agents:Member",
    "agents:House",
    "agents:DailTerm",
    "agents:SeanadTerm",
    "dct:PeriodOfTime",
    "members:OireachtasMembership",
    "members:DailMembership",
    "members:SeanadMembership",
    "members:ParliamentaryCollectionMembership",
    "members:PartyMembership",
    "members:ParliamentaryMemberCollection",
    "members:ParliamentaryParty",
    "members:PoliticalAffiliationIdentity",
    "members:IndependentMemberCollection",
    "members:Constituencies",
    "members:DailConstituency",
    "members:SeanadPanel",
    "members:CommitteeMembership",
    "members:Committee",
    "members:DateRange",
    "members:OfficeHolding",
    "members:NamedOffice",
    "agents:DebateRecord",
    "agents:DebateSitting",
    "eli-dl:DraftLegislationWork",
    "eli-dl:LegislativeProcess",
    "eli-dl:LegislativeActivity",
    "eli-dl:Participation",
    "eli:LegalResource",
    "eli:LegalExpression",
    "eli:Work",
    "eli:Expression",
    "eli:Format"
  ],
  "queryableProperties": [
    "rdf:type",
    "rdfs:label",
    "skos:prefLabel",
    "foaf:name",
    "foaf:firstName",
    "foaf:familyName",
    "dcat:startDate",
    "dcat:endDate",
    "agents:termOf",
    "agents:termNo",
    "agents:houseCode",
    "agents:seats",
    "agents:memberCode",
    "agents:gender",
    "agents:isPrimarySponsor",
    "agents:dateOfDeath",
    "dct:temporal",
    "agents:legislativeYear",
    "agents:debateDate",
    "agents:producedRecord",
    "agents:hasImage",
    "members:hasMembersMembership",
    "members:inHouseTerm",
    "members:isOireachtasMembershipOf",
    "members:hasMembershipDateRange",
    "members:hasOfficeHolding",
    "members:heldOffice",
    "members:StartDate",
    "members:EndDate",
    "members:inOireachtasMembership",
    "members:memberOfCollection",
    "members:hasPoliticalAffiliationIdentity",
    "members:isPartyMembershipOf",
    "members:partyCode",
    "members:activeDuringTerm",
    "members:isRepresentativeFrom",
    "members:representCode",
    "members:constituencyInHouseTerm",
    "members:isCommitteeMembershipOf",
    "members:committeeInHouseTerm",
    "members:committeeCode",
    "members:committeeID",
    "members:hasCommitteeDateRange",
    "owl:sameAs",
    "foaf:isPrimaryTopicOf",
    "members:recognisedAsParty",
    "dct:modified",
    "eli:title",
    "eli:title_alternative",
    "eli:type_document",
    "eli:id_local",
    "eli:basis_for",
    "eli:date_document",
    "eli-dl:process_number",
    "eli-dl:process_type",
    "eli-dl:process_status",
    "eli-dl:was_submitted_by",
    "eli-dl:latest_activity",
    "eli-dl:forms_part_of",
    "eli-dl:had_activity_type",
    "eli-dl:occured_at_stage",
    "eli-dl:activity_date",
    "eli-dl:parliamentary_term",
    "eli-dl:had_participation",
    "eli-dl:had_participant_person"
    ,"eli:has_part"
    ,"eli:is_realized_by"
    ,"eli:is_embodied_by"
    ,"eli:uri_schema"
  ],
  "graphFamilies": [
    {
      "id": "houses",
      "graph": {"kind": "fixed", "iri": "https://data.oireachtas.ie/graph/houses"},
      "owner": "Houses ETL",
      "availability": "published-when-loaded",
      "owns": "Persistent House and HouseTerm descriptions. HouseTerm resources are explicitly typed DailTerm or SeanadTerm, not the generic HouseTerm class."
    },
    {
      "id": "parties",
      "graph": {"kind": "fixed", "iri": "https://data.oireachtas.ie/graph/parties"},
      "owner": "Parties ETL",
      "availability": "published-when-loaded",
      "owns": "Term-scoped ParliamentaryMemberCollection descriptions, labels, party codes, and active-term links."
    },
    {
      "id": "political-affiliations",
      "graph": {"kind": "fixed", "iri": "https://data.oireachtas.ie/graph/political-affiliations/identities"},
      "owner": "Reviewed political-affiliation identity enrichment publication",
      "availability": "optional-reviewed-enrichment",
      "owns": "Reviewed enduring PoliticalAffiliationIdentity descriptions and links from term-scoped ParliamentaryParty resources."
    },
    {
      "id": "constituencies",
      "graph": {"kind": "fixed", "iri": "https://data.oireachtas.ie/graph/constituencies"},
      "owner": "Constituencies ETL",
      "availability": "published-when-loaded",
      "owns": "DailConstituency and SeanadPanel descriptions and their HouseTerm links."
    },
    {
      "id": "committees",
      "graph": {"kind": "fixed", "iri": "https://data.oireachtas.ie/graph/committees"},
      "owner": "Committees ETL",
      "availability": "published-when-loaded",
      "owns": "Committee descriptions, labels, identity codes, classification links, and Committee-owned date ranges. Committee membership tenure remains in Member graphs."
    },
    {
      "id": "member-records",
      "graph": {"kind": "resource-pattern", "iriTemplate": "https://data.oireachtas.ie/graph/member/{percent-encoded-memberCode}"},
      "owner": "Members ETL",
      "availability": "published-when-loaded",
      "owns": "One Member description and that Member's parliamentary, collection, committee, and conditionally resolved office records. References to other owners are not copied."
    },
    {
      "id": "bill-records",
      "graph": {"kind": "resource-pattern", "iriTemplate": "https://data.oireachtas.ie/graph/bill/{year}/{number}"},
      "owner": "Bills ETL",
      "availability": "optional-published-when-loaded",
      "owns": "One Bill's legislative process, lifecycle events, versions, documents, amendment lists, and sponsor references. It does not own Member, Act, or Debate descriptions."
    },
    {
      "id": "offices",
      "graph": {"kind": "fixed", "iri": "https://data.oireachtas.ie/graph/offices"},
      "owner": "Office registry publication",
      "availability": "published-when-loaded",
      "owns": "Reviewed NamedOffice descriptions, controlled role-type links, labels, and evidenced administrative-unit relationships.",
      "note": "The Query Service Phase 2 evaluation bootstrap also loads reviewed registry data into a non-authoritative local dataset; this does not change publication ownership."
    },
    {
      "id": "administrative-units",
      "graph": {"kind": "fixed", "iri": "https://data.oireachtas.ie/graph/administrative-units"},
      "owner": "Administrative-unit registry publication",
      "availability": "published-when-loaded",
      "owns": "Reviewed AdministrativeUnit descriptions and labels.",
      "note": "The Query Service Phase 2 evaluation bootstrap also loads reviewed registry data into a non-authoritative local dataset; this does not change publication ownership."
    },
    {
      "id": "member-external-links",
      "graph": {"kind": "resource-pattern", "iriTemplate": "https://data.oireachtas.ie/graph/member/{percent-encoded-memberCode}/external-links"},
      "owner": "Member reconciliation publication",
      "availability": "optional-reviewed-links",
      "owns": "Accepted external identity and Wikipedia-topic links only; no external descriptions or facts."
    },
    {
      "id": "party-external-links",
      "graph": {"kind": "resource-pattern", "iriTemplate": "https://data.oireachtas.ie/graph/party/{houseCode}/{houseNo}/{percent-encoded-partyCode}/external-links"},
      "owner": "Party reconciliation publication",
      "availability": "optional-reviewed-links",
      "owns": "Reviewed recognition links from a term-scoped Oireachtas party collection to an external political-party identity."
    },
    {
      "id": "institution-external-links",
      "graph": {"kind": "fixed-set", "iris": [
        "https://data.oireachtas.ie/graph/institution/oireachtas/external-links",
        "https://data.oireachtas.ie/graph/institution/house/dail/external-links",
        "https://data.oireachtas.ie/graph/institution/house/seanad/external-links"
      ]},
      "owner": "Institution reconciliation publication",
      "availability": "optional-reviewed-links",
      "owns": "Accepted identity links for enduring Oireachtas and House resources only. HouseTerm instances are not linked as the enduring House."
    },
    {
      "id": "office-external-links",
      "graph": {"kind": "resource-pattern", "iriTemplate": "https://data.oireachtas.ie/graph/office/{registered-office-key}/external-links"},
      "owner": "Office reconciliation publication",
      "availability": "optional-reviewed-links",
      "owns": "Reviewed external office-identity links only."
    },
    {
      "id": "debates",
      "graph": {"kind": "resource-pattern", "iriTemplate": "https://data.oireachtas.ie/graph/debate/{house-or-committee}/{date}/debate"},
      "owner": "Debates ETL",
      "availability": "fixed-development-evaluation-slice-only",